{
  "_doc": "Valor medido de cada perk y palanca de frecuencia (ADR 0038). El valor esta en MILESIMAS de punto de tasa de victoria x2: lo que gana un equipo por llevar ese perk frente a su CONTROL EMPAREJADO (ADR 0087): las mismas plantillas y las mismas semillas de partido, sin el perk. Espejo puro de la misma raza, calidad 50 y nivel 4, portador rotatorio entre los titulares elegibles, en campana de 16 partidos que arrastra el contador de carrera (ADR 0070); values es la columna del horizonte de referencia 8 y valuesByHorizon la curva 1..16 solo para los perks que acumulan (ADR 0085). MEDIDA el 9 sep 2026 (paquete AY, paso 3) con 'dotnet run --project Balance -c Release -- --perk-values --rosters 192 --runs 16 --seed 5' y '--seed 11', SUMANDO los dos lotes: 3.072 partidos por perk y brazo al horizonte 8; el bloque se construye con tools/perk-values-table.py. rowDeviation es la mitad de la RMS de la diferencia entre los dos lotes, horizonte a horizonte (rowDeviationByHorizon). Por que emparejado: con la formula absoluta de la ADR 0070 ((victorias/partidos - 50%) x2) cada perk arrastraba el sesgo de su propia pareja de plantillas, del orden de +-30 unidades: 18 perks 'negativos' median exactamente lo mismo que su control (efecto nulo en el espejo, no perjuicio) y deathless_march estaba infravalorado en 59. Emparejado, rowDeviation baja de 19 a 9. Estado del catalogo con esta medida: ningun perk por debajo de -rowDeviation (regla del revisor: ningun perk negativo); entre -9 y +9 hay perks que no hacen nada en el espejo porque su condicion casi nunca se cumple con un portador al azar (AT-C, limitacion conocida del espejo). Techo aplicado en este paso a los dos unicos perks por encima de +150 (la ADR 0069 los habia subido): deathless_march valuePerCounter 100->50 y maxValue 4->3; clean_sheet_legacy valuePerCounter 50->30 y maxValue 5->3 (con dos pasos las celdas 'muy buena' de la ADR 0033 caian; ADR 0089). Hay que remedirla cuando cambie el motor, el catalogo o la escala. Un perk sin fila (habilidades raciales, perks sin portador elegible en el espejo) usa el valor uniforme.",
  "baseWeight": 100,
  "referenceValue": 500,
  "valueShift": 500,
  "valueFloor": 150,
  "minWeight": 25,
  "maxWeight": 250,
  "referenceHorizon": 8,
  "rowDeviation": 7,
  "rowDeviationByHorizon": [
    16,
    12,
    11,
    10,
    10,
    9,
    9,
    7,
    7,
    7,
    6,
    6,
    5,
    5,
    5,
    5
  ],
  "values": {
    "back_to_back": 3,
    "battle_reader": 150,
    "blood_tithe": 1,
    "box_predator": 6,
    "bruised_knuckles": 3,
    "brute_boots": 5,
    "bulwark_stance": 0,
    "captains_voice": 104,
    "center_conductor": 51,
    "clean_sheet_legacy": 98,
    "cold_focus": 1,
    "comeback_spirit": -3,
    "covering_shadow": 25,
    "crowd_control": -1,
    "deathless_march": 178,
    "diagonal_press": 5,
    "fine_touch": 0,
    "first_touch_school": 26,
    "flank_specialist": 3,
    "forward_line": 18,
    "game_management": 2,
    "gentle_giant": 12,
    "granite_line": 115,
    "high_press_trigger": 0,
    "home_ref": -1,
    "iron_gate": 40,
    "iron_lungs": 12,
    "iron_studs": 7,
    "killing_range": 112,
    "lane_reader": 83,
    "last_ditch": 8,
    "long_leash_legacy": 1,
    "long_range_menace": 10,
    "mob_instigator": -7,
    "own_third_anchor": 10,
    "pit_veteran": 4,
    "pivot_duo": 26,
    "poacher_instinct": 10,
    "road_warrior": 5,
    "safety_net": 0,
    "scar_tissue": 0,
    "scar_veteran": 43,
    "second_wound": -3,
    "sharpshooter_drill": 26,
    "silky_veteran": 0,
    "spearpoint": 8,
    "steady_hands": 6,
    "sweeper_keeper": 7,
    "wing_overlap": 0
  },
  "valuesByHorizon": {
    "battle_reader": [
      0,
      26,
      54,
      68,
      98,
      122,
      127,
      150,
      156,
      175,
      175,
      181,
      185,
      188,
      195,
      201
    ],
    "bruised_knuckles": [
      0,
      3,
      3,
      4,
      4,
      4,
      3,
      3,
      2,
      2,
      2,
      2,
      2,
      1,
      1,
      1
    ],
    "captains_voice": [
      0,
      29,
      68,
      86,
      96,
      107,
      106,
      104,
      106,
      108,
      110,
      115,
      111,
      109,
      108,
      105
    ],
    "clean_sheet_legacy": [
      0,
      36,
      57,
      60,
      83,
      91,
      95,
      98,
      98,
      105,
      109,
      118,
      121,
      122,
      124,
      124
    ],
    "deathless_march": [
      0,
      23,
      111,
      126,
      150,
      161,
      173,
      178,
      183,
      193,
      198,
      205,
      200,
      199,
      208,
      207
    ],
    "iron_lungs": [
      0,
      -18,
      12,
      14,
      27,
      33,
      24,
      12,
      9,
      9,
      9,
      4,
      9,
      11,
      12,
      12
    ],
    "lane_reader": [
      0,
      -3,
      5,
      23,
      23,
      48,
      73,
      83,
      83,
      93,
      96,
      95,
      102,
      108,
      116,
      123
    ],
    "long_leash_legacy": [
      0,
      0,
      0,
      0,
      5,
      14,
      1,
      1,
      -8,
      1,
      7,
      -4,
      2,
      -3,
      -6,
      -10
    ],
    "pit_veteran": [
      0,
      -5,
      -7,
      -5,
      -3,
      1,
      1,
      4,
      5,
      5,
      9,
      10,
      10,
      12,
      12,
      14
    ],
    "poacher_instinct": [
      0,
      8,
      3,
      5,
      8,
      10,
      12,
      10,
      10,
      9,
      9,
      9,
      9,
      10,
      10,
      11
    ],
    "scar_tissue": [
      0,
      0,
      0,
      0,
      0,
      0,
      0,
      0,
      0,
      0,
      0,
      0,
      0,
      0,
      0,
      0
    ],
    "scar_veteran": [
      0,
      3,
      3,
      17,
      41,
      25,
      39,
      43,
      31,
      33,
      25,
      30,
      25,
      21,
      19,
      18
    ],
    "sharpshooter_drill": [
      0,
      13,
      9,
      13,
      16,
      23,
      22,
      26,
      26,
      27,
      25,
      28,
      28,
      29,
      29,
      27
    ],
    "silky_veteran": [
      0,
      0,
      0,
      0,
      0,
      0,
      0,
      0,
      0,
      0,
      0,
      0,
      0,
      0,
      0,
      0
    ],
    "steady_hands": [
      0,
      -8,
      -10,
      -5,
      0,
      4,
      0,
      6,
      12,
      12,
      14,
      12,
      12,
      14,
      17,
      17
    ]
  }
}
